{
  "name": "Gulim (GDI) (International Client)",
  "textureWidth": 4096,
  "textureHeight": 4096,
  "sources": {
    "game:AXIS_96": {
      "fdtPath": "common/font/AXIS_96.fdt",
      "texturePath": "common/font/font{}.tex",
      "textureCount": 7
    },
    "game:AXIS_12": {
      "fdtPath": "common/font/AXIS_12.fdt",
      "texturePath": "common/font/font{}.tex",
      "textureCount": 7
    },
    "game:AXIS_14": {
      "fdtPath": "common/font/AXIS_14.fdt",
      "texturePath": "common/font/font{}.tex",
      "textureCount": 7
    },
    "game:AXIS_18": {
      "fdtPath": "common/font/AXIS_18.fdt",
      "texturePath": "common/font/font{}.tex",
      "textureCount": 7
    },
    "game:AXIS_36": {
      "fdtPath": "common/font/AXIS_36.fdt",
      "texturePath": "common/font/font{}.tex",
      "textureCount": 7
    },
    "game:Jupiter_16": {
      "fdtPath": "common/font/Jupiter_16.fdt",
      "texturePath": "common/font/font{}.tex",
      "textureCount": 7
    },
    "game:Jupiter_20": {
      "fdtPath": "common/font/Jupiter_20.fdt",
      "texturePath": "common/font/font{}.tex",
      "textureCount": 7
    },
    "game:Jupiter_23": {
      "fdtPath": "common/font/Jupiter_23.fdt",
      "texturePath": "common/font/font{}.tex",
      "textureCount": 7
    },
    "game:Jupiter_45": {
      "fdtPath": "common/font/Jupiter_45.fdt",
      "texturePath": "common/font/font{}.tex",
      "textureCount": 7
    },
    "game:Jupiter_46": {
      "fdtPath": "common/font/Jupiter_46.fdt",
      "texturePath": "common/font/font{}.tex",
      "textureCount": 7
    },
    "game:Jupiter_90": {
      "fdtPath": "common/font/Jupiter_90.fdt",
      "texturePath": "common/font/font{}.tex",
      "textureCount": 7
    },
    "game:Meidinger_16": {
      "fdtPath": "common/font/Meidinger_16.fdt",
      "texturePath": "common/font/font{}.tex",
      "textureCount": 7
    },
    "game:Meidinger_20": {
      "fdtPath": "common/font/Meidinger_20.fdt",
      "texturePath": "common/font/font{}.tex",
      "textureCount": 7
    },
    "game:Meidinger_40": {
      "fdtPath": "common/font/Meidinger_40.fdt",
      "texturePath": "common/font/font{}.tex",
      "textureCount": 7
    },
    "game:MiedingerMid_10": {
      "fdtPath": "common/font/MiedingerMid_10.fdt",
      "texturePath": "common/font/font{}.tex",
      "textureCount": 7
    },
    "game:MiedingerMid_12": {
      "fdtPath": "common/font/MiedingerMid_12.fdt",
      "texturePath": "common/font/font{}.tex",
      "textureCount": 7
    },
    "game:MiedingerMid_14": {
      "fdtPath": "common/font/MiedingerMid_14.fdt",
      "texturePath": "common/font/font{}.tex",
      "textureCount": 7
    },
    "game:MiedingerMid_18": {
      "fdtPath": "common/font/MiedingerMid_18.fdt",
      "texturePath": "common/font/font{}.tex",
      "textureCount": 7
    },
    "game:MiedingerMid_36": {
      "fdtPath": "common/font/MiedingerMid_36.fdt",
      "texturePath": "common/font/font{}.tex",
      "textureCount": 7
    },
    "game:TrumpGothic_184": {
      "fdtPath": "common/font/TrumpGothic_184.fdt",
      "texturePath": "common/font/font{}.tex",
      "textureCount": 7
    },
    "game:TrumpGothic_23": {
      "fdtPath": "common/font/TrumpGothic_23.fdt",
      "texturePath": "common/font/font{}.tex",
      "textureCount": 7
    },
    "game:TrumpGothic_34": {
      "fdtPath": "common/font/TrumpGothic_34.fdt",
      "texturePath": "common/font/font{}.tex",
      "textureCount": 7
    },
    "game:TrumpGothic_68": {
      "fdtPath": "common/font/TrumpGothic_68.fdt",
      "texturePath": "common/font/font{}.tex",
      "textureCount": 7
    },
    "gdi:Gulim:9.6": {
      "faceName": "Gulim",
      "height": 10,
      "weight": 400
    },
    "gdi:Gulim:12": {
      "faceName": "Gulim",
      "height": 12,
      "weight": 400
    },
    "gdi:Gulim:14": {
      "faceName": "Gulim",
      "height": 14,
      "weight": 400
    },
    "gdi:Gulim:16": {
      "faceName": "Gulim",
      "height": 16,
      "weight": 400
    },
    "gdi:Gulim:18": {
      "faceName": "Gulim",
      "height": 18,
      "weight": 400
    },
    "gdi:Gulim:20": {
      "faceName": "Gulim",
      "height": 20,
      "weight": 400
    },
    "gdi:Gulim:24": {
      "faceName": "Gulim",
      "height": 24,
      "weight": 400
    },
    "gdi:Gulim:36": {
      "faceName": "Gulim",
      "height": 36,
      "weight": 400
    },
    "gdi:Gulim:40": {
      "faceName": "Gulim",
      "height": 40,
      "weight": 400
    },
    "gdi:Gulim:45": {
      "faceName": "Gulim",
      "height": 45,
      "weight": 400
    },
    "gdi:Gulim:68": {
      "faceName": "Gulim",
      "height": 68,
      "weight": 400
    },
    "gdi:Gulim:90": {
      "faceName": "Gulim",
      "height": 90,
      "weight": 400
    }
  },
  "ranges": {
    "HangulMinimum": {
      "Hangul Jamo": [
        "U+1100",
        "U+11FF"
      ],
      "Hangul Compatibility Jamo": [
        "U+3130",
        "U+318F"
      ],
      "Hangul Jamo Extended-A": [
        "U+A960",
        "U+A97F"
      ],
      "Hangul Syllables": [
        "U+AC00",
        "U+D7AF"
      ],
      "Hangul Jamo Extended-B": [
        "U+D7B0",
        "U+D7FF"
      ]
    },
    "Hangul": {
      "Hangul Jamo": [
        "U+1100",
        "U+11FF"
      ],
      "CJK Symbols and Punctuation": [
        "U+3000",
        "U+303F"
      ],
      "Hangul Compatibility Jamo": [
        "U+3130",
        "U+318F"
      ],
      "Enclosed CJK Letters and Months": [
        "U+3200",
        "U+32FF"
      ],
      "CJK Unified Ideographs Extension A": [
        "U+3400",
        "U+4DBF"
      ],
      "CJK Unified Ideographs": [
        "U+4E00",
        "U+9FFF"
      ],
      "Hangul Jamo Extended-A": [
        "U+A960",
        "U+A97F"
      ],
      "Hangul Syllables": [
        "U+AC00",
        "U+D7AF"
      ],
      "Hangul Jamo Extended-B": [
        "U+D7B0",
        "U+D7FF"
      ],
      "CJK Compatibility Ideographs": [
        "U+F900",
        "U+FAFF"
      ]
    }
  },
  "targets": {
    "font{}.tex": {
      "AXIS_96.fdt": {
        "height": 9.6,
        "ascent": "game:AXIS_96",
        "lineHeight": "game:AXIS_96",
        "sources": [
          {
            "name": "game:AXIS_96"
          },
          {
            "name": "gdi:Gulim:9.6",
            "extendRange": false,
            "replace": true
          },
          {
            "name": "gdi:Gulim:9.6",
            "ranges": [
              "HangulMinimum"
            ]
          }
        ]
      },
      "AXIS_12.fdt": {
        "height": 12,
        "ascent": "game:AXIS_12",
        "lineHeight": "game:AXIS_12",
        "sources": [
          {
            "name": "game:AXIS_12"
          },
          {
            "name": "gdi:Gulim:12",
            "extendRange": false,
            "replace": true
          },
          {
            "name": "gdi:Gulim:12",
            "ranges": [
              "HangulMinimum"
            ]
          }
        ]
      },
      "AXIS_14.fdt": {
        "height": 14,
        "ascent": "game:AXIS_14",
        "lineHeight": "game:AXIS_14",
        "sources": [
          {
            "name": "game:AXIS_14"
          },
          {
            "name": "gdi:Gulim:14",
            "extendRange": false,
            "replace": true
          },
          {
            "name": "gdi:Gulim:14",
            "ranges": [
              "HangulMinimum"
            ]
          }
        ]
      },
      "AXIS_18.fdt": {
        "height": 18,
        "ascent": "game:AXIS_18",
        "lineHeight": "game:AXIS_18",
        "sources": [
          {
            "name": "game:AXIS_18"
          },
          {
            "name": "gdi:Gulim:18",
            "extendRange": false,
            "replace": true
          },
          {
            "name": "gdi:Gulim:18",
            "ranges": [
              "HangulMinimum"
            ]
          }
        ]
      },
      "AXIS_36.fdt": {
        "height": 36,
        "ascent": "game:AXIS_36",
        "lineHeight": "game:AXIS_36",
        "sources": [
          {
            "name": "game:AXIS_36"
          },
          {
            "name": "gdi:Gulim:36",
            "extendRange": false,
            "replace": true
          },
          {
            "name": "gdi:Gulim:36",
            "ranges": [
              "HangulMinimum"
            ]
          }
        ]
      },
      "Jupiter_16.fdt": {
        "height": 16,
        "ascent": "game:Jupiter_16",
        "lineHeight": "game:Jupiter_16",
        "sources": [
          {
            "name": "game:Jupiter_16"
          },
          {
            "name": "gdi:Gulim:18",
            "extendRange": false,
            "replace": true
          },
          {
            "name": "gdi:Gulim:18",
            "ranges": [
              "HangulMinimum"
            ]
          }
        ]
      },
      "Jupiter_20.fdt": {
        "height": 20,
        "ascent": "game:Jupiter_20",
        "lineHeight": "game:Jupiter_20",
        "sources": [
          {
            "name": "game:Jupiter_20"
          },
          {
            "name": "gdi:Gulim:24",
            "extendRange": false,
            "replace": true
          },
          {
            "name": "gdi:Gulim:24",
            "ranges": [
              "HangulMinimum"
            ]
          }
        ]
      },
      "Jupiter_23.fdt": {
        "height": 23,
        "ascent": "game:Jupiter_23",
        "lineHeight": "game:Jupiter_23",
        "sources": [
          {
            "name": "game:Jupiter_23"
          },
          {
            "name": "gdi:Gulim:24",
            "extendRange": false,
            "replace": true
          },
          {
            "name": "gdi:Gulim:24",
            "ranges": [
              "HangulMinimum"
            ]
          }
        ]
      },
      "Jupiter_45.fdt": {
        "height": 45,
        "ascent": "game:Jupiter_45",
        "lineHeight": "game:Jupiter_45",
        "sources": [